pageid,ns,title,extract
2512742.0,0,Chrysler Turbine Car,"The Chrysler Turbine Car is an experimental two-door hardtop coupe powered by a turbine engine and manufactured by Chrysler from 1963–1964. The bodywork was constructed by Italian design studio Carrozzeria Ghia and Chrysler completed the final assembly in Detroit. A total of 55 cars were manufactured: five prototypes and a limited run of 50 cars for a public user program. The car was styled by Elwood Engel and the Chrysler studios and featured power brakes, power steering, and a TorqueFlite transmission. It featured a metallic, root beer-colored paint called ""turbine bronze"".
The Chrysler turbine engine program that produced the Turbine Car began during the late 1930s and created prototypes that completed long-distance trips in the 1950s and early 1960s. The A-831 engines that powered the Ghia-designed Turbine Car could operate on many fuels, required less maintenance, and lasted longer than conventional piston engines, although they were much more expensive to produce. 
After testing, Chrysler conducted a user program from October 1963 to January 1966 that involved 203 drivers in 133 cities in the United States cumulatively driving more than one million miles (1.6 million km). The program helped the company determine problems with the cars, notably with their complicated starting procedure, relatively unimpressive acceleration, and sub-par fuel economy and noise. The experience also revealed advantages of the turbine engines, including their remarkable durability, smooth operation, and relatively modest maintenance requirements.
After the user program ended in 1966, Chrysler reclaimed the cars and destroyed all but nine; Chrysler kept two cars, six are displayed at museums in the United States, and one is in a private collection. Chrysler's turbine engine program ended in 1979, largely due to the failure of the engines to meet government emissions regulations, relatively poor fuel economy, and as a condition of receiving a government loan in 1979."
25802422.0,0,Chrysler VIP,"The Chrysler VIP is an automobile which was produced by Chrysler Australia from 1969 to 1971. It is an extended wheelbase, luxury variant of the Australian developed Chrysler Valiant."
26211962.0,0,Chrysler VZ-6,"The Chrysler VZ-6 was an American VTOL ducted-fan test vehicle designed and built by Chrysler for the United States Army Flying Jeep competition.

"
863298.0,0,Chrysler Valiant,"The Chrysler Valiant was a full-size car which was sold by Chrysler Australia between 1962 and 1981. Initially a rebadged locally assembled Plymouth Valiant from the United States, from the second generation launched in 1963, the Valiant was fully manufactured in Australia. It was sold locally but also in New Zealand and South Africa, with smaller numbers also exported to South-East Asia and the United Kingdom.
Parent company Chrysler made a substantial investment in Australian manufacturing facilities, by establishing operations in South Australia with an assembly plant at Tonsley Park in 1964 and an engine foundry at Lonsdale in 1968. The Valiant thus established its position as the third of the ""Big 3"" Australian-made vehicles behind the Holden Kingswood and Ford Falcon.
The Australian Valiant was built on the North American A-body platform but with many parts and components from Australian suppliers. Apart from a sedan and wagon body style, 1965 saw the introduction of a commercial utility that was badged the Wayfarer and later exported to South Africa as the Rustler. 
Greater differentiation from the donor car creeped in over time, particularly since the VE series, which was embraced by the Australian motoring press and won the 1967 Wheels magazine Car of the Year award. The VF series of 1969 and the VG of 1970 departed even further from its North American donor both in terms of styling and performance—with the latter series introducing the Hemi-6 engine that replaced the Slant-6. Moreover, Australia continued to produce a station wagon model, called the Safari, even after this body style being discontinued for North America.
Beginning in 1971, the VH series saw Chrysler Australia develop the entire lineup locally including the Charger. Local design and production continued until the CM series of 1979, which marked the end of local production in 1981, after the takeover of operations by Mitsubishi Motors Australia."
28488729.0,0,Chrysler Valiant (AP5),"The  Chrysler AP5 Valiant  is an automobile which was produced by Chrysler Australia from 1963 to 1965. It was the third Chrysler Valiant model to be produced in Australia.

"
43996164.0,0,Chrysler Valiant (AP6),"The  Chrysler Valiant AP6 is an automobile which was produced by Chrysler Australia from 1965 to 1966. It was the fourth Chrysler Valiant model produced in Australia.

"
43844496.0,0,Chrysler Valiant (CL),"The Chrysler Valiant (CL) is an automobile which was produced in Australia by Chrysler Australia from 1976 to 1978. The CL, which was the twelfth Australian Chrysler Valiant model, replaced the Chrysler Valiant (VK). It was also built in South Africa by Sigma, who marketed it there as the Chrysler SE."
40195846.0,0,Chrysler Valiant (CM),"The Chrysler CM Valiant is an automobile that was produced in Australia by Chrysler Australia from 1978 to 1980 and subsequently by Mitsubishi Australia from 1980 to 1981. It was a facelifted and revised version of the Chrysler CL Valiant, which it replaced. It was the last Australian Chrysler Valiant."
43835605.0,0,Chrysler Valiant (RV1),"The Chrysler Valiant (RV1) is an automobile which was produced in Australia from January 1962 to March 1962 by Chrysler Australia. It was the first Australian Chrysler Valiant model.The Valiant RV1 (or Valiant R Series) was launched in Australia in January 1962. Completely knocked down (CKD) packs were imported from Windsor in Canada, bodies were painted at Chrysler Australia's Mile End facility and final assembly was undertaken at Tonsley Park. The Australian model comprised a combination of US Valiant V100 base model and V200 deluxe model components."
31063695.0,0,Chrysler Valiant (SV1),"The Chrysler Valiant (SV1) is an automobile which was produced in Australia from March 1962 to April 1963 by Chrysler Australia. It was the second Australian Chrysler Valiant model, replacing the RV1 (R series)"
35889543.0,0,Chrysler Valiant (VC),"The  Chrysler VC Valiant  is an automobile that was produced in Australia by Chrysler Australia from 1966 to 1967. It was released in March 1966, replacing the Chrysler AP6 Valiant. The VC was the fifth Chrysler Valiant model to be produced in Australia."
35922070.0,0,Chrysler Valiant (VE),"The  Chrysler VE Valiant  is an automobile that was produced in Australia by Chrysler Australia from 1967 to 1969. It was released in October 1967, replacing the Chrysler VC Valiant. The premium model in the range was renamed Valiant VIP due to the V8 engine becoming an option across the entire range."
37511681.0,0,Chrysler Valiant (VF),"The  Chrysler VF Valiant  is an automobile that was produced in Australia by Chrysler Australia from 1969 to 1970. It was released in March 1969, replacing the Chrysler VE Valiant."
44012759.0,0,Chrysler Valiant (VG),The  Chrysler Valiant (VG) is an automobile which was produced in by Chrysler Australia from 1970 to 1971. It was the eighth Chrysler Valiant model to be produced in Australia.
33948141.0,0,Chrysler Valiant (VH),The  Chrysler VH Valiant  is an automobile which was produced by Chrysler Australia from June 1971 to March 1973. It replaced the VG series Valiant and was the first Valiant model to be a uniquely Australian design.
33948155.0,0,Chrysler Valiant (VJ),The  Chrysler VJ Valiant  is an automobile which was produced by Chrysler Australia from 1973 to 1975. It replaced the Chrysler VH Valiant and was a facelifted and revised version of that model. The VJ series Valiant was the tenth Chrysler Valiant model from Chrysler Australia.
43844500.0,0,Chrysler Valiant (VK),The  Chrysler Valiant (VK) is an automobile which was produced by Chrysler Australia from October 1975 to October 1976. It was the eleventh Australian produced Chrysler Valiant series.
3635147.0,0,Chrysler Valiant Charger,"The Chrysler Valiant Charger was a two-door hardtop coupe introduced by Chrysler Australia in 1971. It was a short wheelbase version of the concurrent Australian Chrysler Valiant sedan. Introduced within the VH Valiant series, it continued as a variant through the subsequent VJ, VK and CL series, until production ceased in 1978. It was marketed and badged as the Valiant Charger in the VH and VJ series and as the Chrysler Charger in the later VK and CL series.
While still based on the US Chrysler A-body platform, with virtually identical front suspension, the fenders were widened, and a wider rear axle fitted, so that the track, front and rear, was considerably wider than any US A-body, this also allowed wheels much wider than a US A-body. The Australian Chargers also used a 5-on-4.5"" wheel bolt circle (still 7/16"" studs), while the US cars did not go to ""big bolt pattern"" until 1973.
The Charger was extraordinarily popular in Australia during the VH series. At one point Charger production totalled 80% of all Australian Valiant production.
The VH Valiant Charger achieved critical acclaim, winning the 1971 Australian Wheels Car of the Year Award. It was also popular in New Zealand where they were assembled from imported kits.
The sporty image of the Charger faded through the VJ range of cars and was neutered altogether by 1975 release of the VK series.
During the seven years of production, the Charger carried many variations of essentially two basic powerplants, based on the Chrysler Hemi-6 Engine and versions of the Chrysler LA engine V8."
12720827.0,0,Chrysler Viper GTS-R,"The Chrysler Viper GTS-R (also known as the Dodge Viper GTS-R when raced in North America) was a successful racing variant of the Dodge Viper developed in conjunction with Chrysler of North America, Oreca of France, and Reynard Motorsport of the United Kingdom.  Officially unveiled at the 1995 Pebble Beach Concours, it has won numerous championships and famous events in its history.  Some chassis are still in use today."
863472.0,0,Chrysler Voyager,"The Chrysler Voyager (and the long-wheelbase Chrysler Grand Voyager) is a minivan being produced by the Chrysler division of Stellantis. In the current lineup, it is positioned as the lower-end Chrysler minivan, having replaced the Dodge Grand Caravan in 2020, below the Chrysler Pacifica.
The Chrysler Voyager was introduced in Europe in 1988, and was a rebadged version of the Dodge Caravan in the United States. It originally evolved with the Caravan, the Plymouth Voyager, and the Chrysler Town & Country. In the United States, the Chrysler Voyager nameplate replaced the short-wheelbase (SWB) version of the Plymouth Voyager following the folding of the Plymouth division by DaimlerChrysler AG in 2001, and was discontinued in 2003. The nameplate was revived for the 2021 model year following the discontinuation of the Dodge Grand Caravan after the 2020 model year, and is rebadged as the Chrysler Grand Caravan in Canada.In Europe, the Chrysler Voyager was rebadged as the Lancia Voyager from the 2011 to 2016 model years. The Voyager was sold with different engines, including diesel engines, and was also available with manual transmission and a foot-operated emergency brake. Although now produced solely in Ontario, Canada, the Grand Voyagers were still available with diesel engines as standard. These diesel engines are based on a modern double overhead cam common rail design from VM Motori of Italy. The last European Chrysler Grand Voyagers are very similar to the 2008 and later Chrysler Town & Country cars, and were sold only in the long-wheelbase version (as in North America). Following the fifth generation, the Grand Voyager nameplate was discontinued in all markets.
Together with its nameplate variants, the Chrysler minivans have ranked as the 13th bestselling automotive nameplate worldwide, with over 12 million sold."
1453796.0,0,Chrysler Windsor,"The Chrysler Windsor is a full-size car which was built by Chrysler from 1939 through to the 1960s.  The final Chrysler Windsor sold in the United States was produced in 1961, but production in Canada continued until 1966. The Canadian 1961 to 1966 Windsor model was for all intents and purposes the equivalent of the Chrysler Newport in the United States.
The Windsor was almost identical to the more luxurious Chrysler New Yorker in terms of size, interior and standard features except that it was only available with the Chrysler Straight Six that originally started the company in 1925, which offered customers a luxurious car with a more modest and economic engine. As the years progressed and technology and manufacturing costs improved, the Windsor offered items that were initially optional as standard equipment while maintaining a market position lower in the Chrysler product hierarchy.
The Windsor was mechanically similar to the Royal from 1939 to 1950 and offered more standard equipment and an upscale interior to the well equipped Royal while both vehicles came with the Chrysler Straight Six. As the Royal nameplate was discontinued for the 1951 model year the Windsor became Chrysler's six cylinder coupe until 1955 when the Poly V8 was introduced. For the 1961 model year the Chrysler Newport assumed the market position originally held by the Royal, keeping the Windsor positioned one level above the Newport. Chrysler replaced the Windsor name in 1962 with the introduction of the non-lettered series Chrysler 300.

"
26024239.0,0,Chrysler ball-stud hemi,"The ball-stud hemi (known internally as A279 and affectionately as the BS Hemi)  was an automobile engine designed by Chrysler Corporation in the late 1960s. It never entered production.Intended to deal with the troubles created by the low-production 426, of which only about 9,000 were built from 1966 to 1972), as well as the different architectures of the higher-volume 383 cu in (6.3 l) and 400 cu in (6.6 l) B and 440 cu in (7.2 l) RB V8s, the ball-stud hemi was to be suitable for high-volume manufacture at low cost while generating high performance. Chrysler hoped to replace three block and two head designs with the ball-stud design.  It was to be based on a low-deck block and available in 400 cu in (6.6 l) (4.34 by 3.38 in (110 by 86 mm)) and 440 cu in (7.2 l) 4.32 by 3.75 in (110 by 95 mm)) displacements (and Chrysler considered a 444 cu in (7.3 l), which could have used stock 4.34 in (110 mm) 400 cu in (6.6 l) pistons), while the new valvetrain would cut both weight and cost, as well as making it possible to fit it in a greater variety of models.The A279 initially used the B-block head bolt pattern, which ""badly hampered"" its exhaust ports, forcing the use of a serpentine flow around some of the outer bolts This was changed late in development, but not before some tooling based on the original design had already been created. This meant the head was not truly hemispherical, but had more intake port area than exhaust (3.575 in2 (23.06 cm2)  versus (2.488 in2 (16.05 cm2)).Its intake valves were nearer the intake manifold, exhaust valves nearer the exhaust pipes. The staggered ""poly"" arrangement improves airflow by ""reducing valve shrouding and eliminating the sharp runner turns"" of inline valve arrangements. It also had equally spaced intake ports (similar to the 428SCJ), thereby achieving ""more consistent mixture distribution"" than the Wedges. Chrysler used a 14 mm (0.55 in) spark plug, rather than the typical 18 mm (0.71 in), in an effort to fit it as centrally as possible in the combustion chamber.The intake and exhaust valves were the same size as the 426's, the 2.25 in (57 mm) intake canted at 15° from the bore centerline, the 1.94 in (49 mm) exhaust at 6°. By contrast, the B-block's were 2.08 in (53 mm) and 1.74 in (44 mm).Compared to the wedge, the ball-stud block had two additional clean-out holes to remove casting sand, because the large bore made coolant in the water jacket very significant, and an additional oil drainback hole at either end of the block, due to demand for lubrication of the rocker arms. Suggestions to increase the size of the oil pump pickup to 3⁄8 in (9.5 mm)  (compared to the 426's 1⁄2 in (12.7 mm)) never passed the endurance testing stage.Pistons were to be cast aluminum. Compression ratio was targeted as 10.5:1; on the surviving engine, it was measured at 9.8:1. Forged  connecting rods used the Wedge's 3⁄8 in (9.5 mm) hardware, as opposed to the Hemi's 7⁄16 in (11.1 mm), but would nonetheless have been considered high-performance parts.The intake was to be a single Carter ThermoQuad, of greater flow than any previously used, on a dual-plane intake manifold, while dual four-barrels were never even considered, in the face of toughening emissions standards. A split-level (vertically split, rather than horizontally divided) intake was also experimented with.Chrysler hoped to have the ball-stud in production sometime between 1971 and 1973. In testing, it proved able to outperform the single four-barrel carburetted A134 440, and lagged behind the eight-barrel A102 426 Street Hemi. About one year of development was put in before the project was stopped, in late 1969. It was a victim of increasing demand for emissions controls and a reduction in emphasis on performance, as the ""horsepower wars"" wound down. Moreover, Chrysler was suffering ""severe financial stresses"" that nearly brought the company down, so the new production tooling and facilities were now uneconomic.Estimates of the number built vary from three to twelve. Only one is known to survive."
44291615.0,0,Chrysler by Chrysler,"The Chrysler by Chrysler is an automobile produced by Chrysler Australia from 1971 to 1976. It is an extended wheelbase, luxury variant of the Australian developed Chrysler Valiant."
15216412.0,0,Chrysler ecoVoyager,"The Chrysler ecoVoyager is a concept car that was revealed on January 14, 2008 by Chrysler. It was introduced at the 2008 North American International Auto Show. The combination of a lithium-ion battery pack with an advanced hydrogen fuel cell was claimed to provide a range of 300 miles (483 kilometres)."
863584.0,0,Chrysler flathead engine,"The Chrysler flathead engine is a flathead automotive engine manufactured by the Chrysler Corporation from 1924 through the early 1960s. The flathead engine came in four-,six, and eight-cylinder configurations and varying displacement, with both a cast iron and cast aluminum cylinder head. It was installed in Chrysler, DeSoto, Dodge and Plymouth branded vehicles."
860262.0,0,Chrysler minivans,"The Chrysler minivans are a series of minivans that have been produced and marketed by the American automaker Chrysler. In production since the 1984 model year, Chrysler has produced six distinct generations of minivans; at various stages of their production, Chrysler minivans have been marketed worldwide, primarily in North America and Europe.
Initially introduced as the Dodge Caravan and Plymouth Voyager, the Chrysler minivans have been marketed under a variety of nameplates under Chrysler, Plymouth, Dodge, and Ram brands; through the use of rebadging, Chrysler minivans have also been marketed under the Lancia and Volkswagen brands.
The Chrysler minivans are the highest-selling example of the segment, with over 12 million produced up to 2008 and a grand total of 15 million reached in 2019.The introduction of the Chrysler minivans popularized the use of the body style by automakers in the United States and Canada, leading to competitors such as the Chevrolet Astro/GMC Safari, Ford Aerostar, Toyota Previa, and Mazda MPV. During the 1990s, the popularity of the Chrysler minivans led to the form factor becoming closely followed by many competitors, leading to the Ford Windstar/Freestar, Honda Odyssey, Toyota Sienna, Kia Sedona, and Nissan Quest.
Since their 1984 introduction, Chrysler has manufactured minivans at Windsor Assembly, in Windsor, Ontario, Canada; from 1987 to 2007, Saint Louis Assembly in Fenton, Missouri added additional manufacturing in North America. For the European market, exports were largely supplemented by the Eurostar joint-venture factory in Graz, Austria from 1992 to 2002.

"
53150792.0,0,Chrysler minivans (AS),"The second-generation Chrysler minivans are a series of minivans that were manufactured and marketed by Chrysler Corporation in North America and Europe from 1991 to 1995.  Officially designated the AS platform by Chrysler, the second-generation minivans were an extensive revision of the first-generation chassis and body.  As before, passenger and cargo configurations were sold by Dodge, Plymouth, and Chrysler divisions.  The first minivans offered with driver-side airbags (in 1991) and with optional integrated child safety seats (in 1992), the second-generation Chrysler minivans offered all-wheel drive as an option for the first time; a manual transmission would be offered for the last time in the North American market.As with its predecessor, Chrysler assembled second-generation minivans at Windsor Assembly in Windsor, Ontario, Canada, with additional production at Saint Louis (North) Assembly in Fenton, Missouri from 1990 to 1994.  In 1992, to supplement exports from the United States, the Chrysler Voyager and Dodge Mini Ram Van began production in Graz, Austria (in the Eurostar joint venture factory between Chrysler and Steyr-Daimler-Puch).  
For the 1996 model year, the AS-generation minivans were replaced by the NS platform, marking the first complete redesign of the Chrysler minivans since their 1984 introduction."
53151364.0,0,Chrysler minivans (NS),"The third-generation Chrysler minivans are a series of passenger minivans that were marketed by the Chrysler Corporation (later DaimlerChrysler) from the 1996 to 2000 model years.  Designated the NS platform by Chrysler, these minivans were sold by Chrysler, Dodge and Plymouth divisions in passenger configurations; minivans were exported under the Chrysler brand.  While the second-generation AS platform was a revision of the original vans, the NS platform marked the first ground-up redesign of the Chrysler vans since their 1984 introduction, ending the use of components from K-Car derivatives.
The first non-compact minivans in North America to adopt four sliding passenger doors, the third-generation Chrysler minivans saw their form factor adopted by many competitors. In addition to chief competitors Ford Windstar, Honda Odyssey, and Toyota Sienna, the NS-platform configuration was adopted by the Chevrolet Venture, Oldsmobile Silhouette, and Pontiac (Trans Sport) Montana, and the Mercury Villager/Nissan Quest.
In line with the first and second-generation minivans, the third-generation minivans were assembled at Windsor Assembly in Windsor, Ontario, Canada, with additional production sourced from Saint Louis (South) Assembly in Fenton, Missouri. To supplement exports from the United States, production of the Chrysler Voyager was sourced from Graz, Austria (in the Eurostar joint venture factory between Chrysler and Steyr-Daimler-Puch).

"
53150446.0,0,Chrysler minivans (RS),"The RS-platform Chrysler minivans are a series of passenger minivans marketed by Chrysler from model years 2001 to 2007, the fourth in six generations of Chrysler minivans, which were heavily revised versions of the NS minivans. Depending on the market, these vans were known as the Dodge Caravan, Chrysler Town & Country, and the Chrysler Voyager. With the discontinuation of the Plymouth brand, the Plymouth Voyager didn't return."
53152064.0,0,Chrysler minivans (RT),"The RT-platform Chrysler minivans are a series of passenger minivans marketed by Chrysler starting in model year 2008, the fifth in six generations of Chrysler minivans. Depending on the market, these vans were known as the Dodge Grand Caravan, Chrysler Town & Country, Chrysler Grand Voyager, Lancia Voyager and the Volkswagen Routan, a modified version sold by Volkswagen in North America. Only long wheelbase models were offered with the Dodge Journey replacing the short wheelbase model. While most versions were discontinued in 2016 with the launch of the Chrysler Pacifica minivan, the Grand Caravan remained in production until 2020. It was replaced by the sixth generation Chrysler Voyager (continuing under the Grand Caravan nameplate in Canada), a new entry-level model based on the existing Chrysler Pacifica minivan."
53150313.0,0,Chrysler minivans (S),"The first-generation Chrysler minivans are a series of minivans produced and marketed by the Chrysler Corporation from the 1984 to the 1990 model years.  In a product introduction that would popularize the minivan as a vehicle in North America, Chrysler introduced the Dodge Caravan and the Plymouth Voyager, launched ahead of chief competitors Chevrolet Astro/GMC Safari and Ford Aerostar.
Designated the Chrysler S platform, the front-wheel drive vans were produced as both passenger and cargo vans.  Initially produced in a single wheelbase, a long-wheelbase Grand Caravan/Grand Voyager was introduced for 1987.  For 1988, the Chrysler Voyager was introduced for export sale, competing against the Renault Espace.  For 1990, the luxury-trim Chrysler Town & Country was introduced.
Chrysler manufactured the S-platform minivans in the United States and Canada in its Saint Louis Assembly (Fenton, Missouri) and Windsor Assembly (Windsor, Ontario) facilities."
