pageid,ns,title,extract
947390.0,0,Chevrolet Aveo (T200),"The Chevrolet Aveo (T200) ( ə-VAY-oh) is the first generation of the Chevrolet Aveo, a subcompact automobile from the Chevrolet division of the American manufacturer General Motors, launched in 2002, developed by the initially independent South Korean manufacturer Daewoo, later GM Korea. It was originally marketed as the Daewoo Kalos and prominently marketed as the Aveo. The model received the T200 internal codes during the car's development. The T250 code was designated for the model's facelift.
Designed, engineered and originally marketed by GM Daewoo, the Aveo superseded the Daewoo Lanos and was marketed worldwide in 120 countries under seven brands (Chevrolet, Daewoo, Holden, Pontiac, Ravon, Suzuki and ZAZ). In its home market of South Korea, the T200 was known as Daewoo Kalos, before being rebranded Daewoo Gentra. In several Asian, Australasian, and European export markets, the ""Daewoo Kalos"" name was also used, only to be later renamed ""Chevrolet Aveo"" or Holden Barina in the case of Australasia. In Indonesia this generation sold in 3 names, ""Chevrolet Aveo"" for hatchback, ""Chevrolet Kalos"" for sedan and sedan for taxi fleet as ""Chevrolet Lova"". Other names used include ZAZ Vida in Ukraine, Ravon Nexia in Russia, Chevrolet Nexia in Uzbekistan, Chevrolet Lova in China and Pontiac G3 in the United States, selling alongside the ""Chevrolet Aveo"" version. In Canada, the name Pontiac Wave was originally used, followed by Pontiac G3 Wave, before adopting the ""Pontiac G3"" name used in the United States. Since 2003, Suzuki has also sold a version in Canada as the Suzuki Swift+ alongside the Chevrolet and Pontiac badged versions. T200's successor, the T300 was released in 2011. The Swift+ was dropped after the 2011 model year due to poor sales along with the entire Suzuki brand, although Suzuki Canada lists 2010 as the final model year Swift+. In addition, the release of the Pontiac Wave5 is also very relevant to determine the difference of production years and production model names."
45292845.0,0,Chevrolet Beach Volleyball Centre,"The Chevrolet Beach Volleyball Centre was a temporary beach volleyball facility built at Exhibition Place (parking lot south of BMO Field) for the 2015 Pan American Games in Toronto, Ontario, Canada. The venue hosted the beach volleyball competitions at the games from July 13–21. A total of 3,000 metric tonnes of sand was used to build the temporary courts.The courts were removed following the games in preparation for the Marketplace venue for the 2015 Canadian National Exhibition."
7995638.0,0,Chevrolet Beauville,The Chevrolet Beauville was originally a station wagon option for the 1954 Chevrolet Bel Air.  The name was later resurrected as a full-size van option for the Chevrolet Van in 1970. Both were related to the lower trim level Chevrolet Townsman.
407729.0,0,Chevrolet Bel Air,"The Chevrolet Bel Air is a full-size car that was produced by Chevrolet for the 1950–1975 model years. Initially, only the two-door hardtops in the Chevrolet model range were designated with the Bel Air name from 1950 to 1952. With the 1953 model year, the Bel Air name was changed from a designation for a unique body shape to a premium level of trim applied across a number of body styles. The Bel Air continued with various other trim level designations, and it went from a mid-level trim car to a budget fleet sedan when U.S. production ceased in 1975. Production continued in Canada, for its home market only, through the 1981 model year.
The Chevrolet Bel Air, especially its third generation design, has been considered an icon of the 1950s. Well-maintained and preserved examples are highly sought after by car collectors and enthusiasts."
1088255.0,0,Chevrolet Beretta,"The Chevrolet Beretta is a front-wheel-drive two-door coupé produced by Chevrolet from 1987 until 1996. The Beretta was designed in the same design studio as the Camaro and the Corvette, Chevrolet Exterior Studio 3, and was built at the Wilmington, Delaware, and Linden, New Jersey assembly plants with other GM L platform models, the Chevrolet Corsica which came shortly before the Beretta, and the Canada-only Pontiac Tempest four-door sedans. The Beretta was produced in base, CL, GT, GTU, Indy, GTZ and Z26 models. A convertible was the pace car for the 1990 Indianapolis 500, and GM initially announced a production convertible replica, but a coupe version was offered instead."
388178.0,0,Chevrolet Biscayne,"The Chevrolet Biscayne was a series of full-size cars produced by the American manufacturer Chevrolet between 1958 and 1975. Named after a show car displayed at the 1955 General Motors Motorama, the Biscayne was the least expensive model in the Chevrolet full-size car range (except the 1958-only Chevrolet Delray). The absence of most exterior and fancy interior trimmings remained through the life of the series, as the slightly costlier Chevrolet Bel Air offered more interior and exterior features at a price significantly lower than the top of the line Impala and Caprice.
The Biscayne was named after Biscayne Bay, near Miami, Florida, following a trend by Chevrolet at the time to name cars after coastal cities or beaches such as the Bel Air and the later Chevrolet Malibu."
947399.0,0,Chevrolet Blazer,"Chevrolet Blazer (and GMC Jimmy) can refer to one of several SUV models from General Motors:

The full-size Chevrolet K5 Blazer, based on the C/K pickup chassis and built from 1969 to 1995 (renamed Blazer in 1992 and Tahoe in 1995 for the 2-door model)
The compact and mid-size Chevrolet S-10 Blazer, based on the S-10 pickup and built from 1983 to 2005
The Chevrolet TrailBlazer (2001–2009), originally a trim package on the S-10 Blazer until 2002, when it became its own larger model
The Chevrolet Tahoe, sold in Argentina, Brazil, Ecuador and Venezuela under the Grand Blazer name from 1990 to 2000 to 2019
The Chevrolet Blazer (2019–present), a mid-size crossover that has been available since 2019
The Chevrolet Trailblazer (2019–present), a subcompact crossover that has been available since 2019 in China and 2020 in North America"
57738717.0,0,Chevrolet Blazer (crossover),"The Chevrolet Blazer is a mid-size crossover SUV produced by General Motors brand Chevrolet. The vehicle went into production in December 2018 and sales began in January 2019 as a 2019 model. In China, it is a larger, 7-seat crossover SUV, which debuted in 2019 and went on sale in April 2020."
45029951.0,0,Chevrolet Bolt,"The Chevrolet Bolt or Chevrolet Bolt EV is a battery electric subcompact hatchback produced by General Motors under the Chevrolet marque. It was developed and manufactured in partnership with LG Corporation. A rebadged European variant was sold as the Opel Ampera-e in mainland Europe, but was discontinued after 2018.
Sales of the 2017 Bolt began in California in December 2016, with nationwide US and international markets release in 2017. The Bolt was the U.S. second best selling plug-in car in 2017. Global combined Bolt/Ampera-e family sales totaled 112,000 units by the end of 2020.
The Bolt was named the 2017 Motor Trend Car of the Year, the 2017 North American Car of the Year, an Automobile Magazine 2017 All Star, and was listed in the Time Magazine's Best 25 Inventions of 2016.The Bolt has been subject to a number of recalls, with concerns over the battery pack spontaneously catching fire. In August 2021, GM issued a statement advising owners to park in open areas, at least 50 feet away from other vehicles, due to the possibility of the battery pack catching fire."
64553203.0,0,Chevrolet Bolt EUV,"The Chevrolet Bolt EUV (short for “electric utility vehicle”) is a battery electric subcompact crossover SUV manufactured by General Motors under the Chevrolet marque. It was revealed on February 14, 2021. It is positioned as a larger version of the similarly-named Chevrolet Bolt EV.It will be the first Chevrolet vehicle to receive the hands-free Super Cruise driver-assistance package.Unlike early versions of the Bolt EV, the battery for the Bolt EUV is manufactured in the United States at LG plants in Michigan.It was introduced in the Mexican market on August 17, 2021."
2697027.0,0,Chevrolet Brookwood,"The Chevrolet Brookwood is a series of full-size station wagons produced by Chevrolet from 1958 to 1961, and again from 1969 to 1972. It debuted in 1958 as Chevrolet's mid-range model in its station wagon lineup, positioned between the less expensive Yeoman and more luxurious Nomad station wagons. After the Yeoman was discontinued in 1959, the Brookwood was subsequently demoted to entry-level status, before going out of production altogether in 1961. It made a brief reappearance from 1969 and 1972, once again as the least-expensive wagon in Chevrolet's lineup."
865369.0,0,Chevrolet C/K,"C/K is a series of trucks that was manufactured by General Motors from the 1960 to 2002 model years.  Marketed by both the Chevrolet and GMC divisions, the C/K series encompassed a wide range of vehicles. While most commonly associated with pickup trucks, the model line also included chassis-cab trucks and medium-duty trucks and served as the basis for GM full-size SUVs.  Through its entire production, the model line competed directly against the Ford F-Series and the Dodge D series (later the Dodge Ram pickup).
Used for both the model branding and the internal model code, ""C"" denoted two-wheel drive; ""K"" denoted four-wheel drive. Four generations of the model line were produced, including the second-generation ""Action Line"" and third-generation ""Rounded Line"" vehicles.  For the fourth generation, GMC revised its branding, changing to a singular GMC Sierra nameplate (C/K remained as an internal model code).  
For South America, the model line was manufactured by General Motors Brazil, who produced versions of the model line for Brazil, Argentina, and Chile from 1964 to 2001.  
As GM entered the 1990s, the company revised its truck ranges, replacing the medium-duty C/K trucks with the Chevrolet Kodiak/GMC TopKick for 1990.  For 1999, GM replaced the fourth-generation C/K pickup trucks with an all-new model line; in line with GMC, Chevrolet dropped the C/K nameplate (in favor of a singular Chevrolet Silverado nameplate).  Initially marketed with its successor, the final C/K pickup trucks were produced for the 2000 model year. From 2001 to 2002, the final vehicles of the C/K model line were heavy-duty chassis cab trucks."
234492.0,0,Chevrolet Camaro,"The Chevrolet Camaro is a mid-size American automobile manufactured by Chevrolet, classified as a pony car. It first went on sale on September 29, 1966, for the 1967 model year and was designed as a competing model to the Ford Mustang. The Camaro shared its platform and major components with the Firebird, produced by Chevy's sister division Pontiac, also introduced for 1967.
Four distinct generations of the Camaro were developed before production ended in 2002. The nameplate was revived on a concept car that evolved into the fifth-generation Camaro; production started on March 16, 2009. Over 5 million Camaros have been sold.

"
8635173.0,0,Chevrolet Camaro (fifth generation),"The fifth-generation Chevrolet Camaro is a pony car that was manufactured by American automobile manufacturer Chevrolet from 2010 to 2015 model years. It is the fifth distinct generation of the muscle/pony car to be produced since its original introduction in 1967. Production of the fifth generation model began on March 16, 2009 after several years on hiatus since the previous generation's production ended in 2002 and went on sale to the public in April 2009 for the 2010 model year."
9131254.0,0,Chevrolet Camaro (first generation),"The first-generation Chevrolet Camaro is an American pony car introduced by Chevrolet in the fall of 1966 for the 1967 model year. It rode on a brand-new rear wheel drive GM F-body platform and was available as a 2-door, 2+2 seat, hardtop, and convertible. The F-body was shared with the Pontiac Firebird for all generations. A 230 cu in  Chevrolet straight-6 was standard, with several Chevy V8s available as options. The first-generation Camaro was built through the 1969 model year.
Almost all of 1967–1969 Camaros were built in the two U.S. assembly plants: Norwood, Ohio and Van Nuys, California. There were also five non-U.S. Camaro assembly plants in countries that required local assembly and content. These plants were located in the Philippines, Belgium, Switzerland, Venezuela, and Peru."
8639567.0,0,Chevrolet Camaro (fourth generation),"The fourth-generation Chevrolet Camaro is a pony car that was produced by American automobile manufacturer General Motors for the 1993 through 2002 model years. It was introduced on an updated F-body platform, but retained the same characteristic since the first-generation's introduction back in 1967; 2-doors, 2+2 seating, coupé (with optional T-top roof) or convertible bodystyles, rear-wheel drive, and a choice of pushrod V6 and V8 engines. The Camaro was revised in 1998 with both exterior and engine changes. General Motors discontinued production of the fourth generation of the Camaro due to slow sales, a deteriorated sports coupé market, and plant overcapacity."
8776522.0,0,Chevrolet Camaro (second generation),"The second-generation Chevrolet Camaro is an American pony car that was produced by Chevrolet from 1970 through the 1981 model years. It was introduced in the spring of 1970. Build information for model 123-12487 was released to the assembly plants in February of that same year. It was longer, lower, and wider than the first generation Camaro. A convertible, which was available for the first generation, was unavailable for the second. GM engineers have said the second generation is much more of ""A Driver's Car"" than its predecessor."
46896692.0,0,Chevrolet Camaro (sixth generation),"The sixth-generation Chevrolet Camaro is an American pony car. Produced by automobile manufacturer Chevrolet, it was first introduced to the public on May 16, 2015. Sales started in 2015 for the 2016 model year. The Camaro now utilizes the GM Alpha platform shared with the Cadillac ATS and CTS and features MacPherson struts in front, rather than the former multi-link setup. General Motors claims that 70 percent of architectural components in the new Camaro are unique to the car.The sixth generation of Camaro saw production return to the United States as the fourth and fifth-generation models had been assembled in Canada.Like its predecessor, the sixth generation of the Camaro is available in coupé and convertible bodystyles. Compared to the previous generation, it is 2.3 in (58 mm) shorter, 0.8 in (20 mm) narrower and 1.1 in (28 mm) shorter in height. With similar equipment and engine, it is also more than 200 lb (91 kg) lighter."
8739264.0,0,Chevrolet Camaro (third generation),"The third-generation Chevrolet Camaro is an American pony car which was introduced for the 1982 model year by Chevrolet. It continued to use General Motors' F-body platform and produced a ""20th Anniversary Commemorative Edition"" for 1987 and ""25th Anniversary Heritage Edition"" for 1992. These were also the first Camaros with factory fuel injection, four-speed automatic transmissions, five-speed manual transmissions, four-cylinder engines, 16-inch wheels, and hatchback bodies. For 1987 a convertible Camaro was reintroduced, converted by ASC in relatively small numbers. The third-generation Camaro continued through the 1992 model year."
406306.0,0,Chevrolet Caprice,"The Chevrolet Caprice  is a full-sized automobile produced by Chevrolet in North America for the 1965 to 1996 model years. Full-size Chevrolet sales peaked in 1965 with over a million sold. It was the most popular American car in the sixties and early seventies, which, during its lifetime, included the Biscayne, Bel Air, and Impala.
Introduced in mid-1965 as a luxury trim package for the Impala four-door hardtop, Chevrolet offered a full line of Caprice models for the 1966 and subsequent model years, including a ""formal hardtop"" coupe and an Estate station wagon. The 1971 to 1976 models are the largest Chevrolets ever built. The downsized 1977 and restyled 1991 models were awarded Motor Trend Car of the Year. Production ended in 1996.
From 2011 to 2017, the Caprice nameplate returned to North America as a full-size, rear wheel drive police vehicle, a captive import from Australia built by General Motors's subsidiary Holden—the police vehicle is a rebadged version of the Holden WM/WN Caprice. The nameplate also had a civilian and police presence in the Middle East from 1999 to 2017, where the imported Holden Statesman/Caprice built by Holden was marketed as the Chevrolet Caprice in markets such as the UAE and Saudi Arabia."
1826282.0,0,Chevrolet Captiva,"The Chevrolet Captiva is a compact crossover SUV developed by General Motors under their Chevrolet marque. The first generation was developed by GM Korea, based on the GM Theta platform and derived from the S3X concept car revealed in 2004. The crossover straddles the entry-level SUV segments. Released in 2006, it was sold internationally as Chevrolet Captiva, in Australia and New Zealand as Holden Captiva and in South Korea as Daewoo Winstorm until 2011, when the international name was adopted. The 2.4i petrol model's seem to have created a bad reputation for fuel consumption running at about 13/L per 100 km, wherby the diesel 2.0 and 2.2 had great consumption with an average of 8.5/L per 100km. Although the auto gearboxes on any model Captiva have a common issue of vibrations when shifting this a factory default and unfortunately cannot be resolved you would have to live with vibrations on shifting, GM has no resolution for this on any of their auto gearboxes. The Theta platform also underpins the Opel Antara. On 13 September 2018, Chevrolet announced that it is ending production on the first generation Captiva and replacing it worldwide with the Equinox. The second generation Captiva, which is a rebadged Baojun 530, was introduced in Colombia in November 2018 and Thailand in March 2019.

"
684166.0,0,Chevrolet Cavalier,"The Chevrolet Cavalier is a line of small cars produced for the model years 1982 through 2005 by Chevrolet, and then later reintroduced in 2016 for the Chinese Market. As a rebadged variant of General Motors' J-cars, the Cavalier was manufactured alongside the Cadillac Cimarron, Buick Skyhawk, Oldsmobile Firenza, and Pontiac J2000/2000/Sunbird at GM's South Gate Assembly and Janesville Assembly plants, achieving its highest sales in 1984.

"
622553.0,0,Chevrolet Celebrity,"The Chevrolet Celebrity is a mid-size automobile that was produced by the Chevrolet division of General Motors from the 1982 to 1990 model years. Replacing the Malibu, the Celebrity was initially positioned between the Citation and the Impala within the Chevrolet model line; as the 1980s progressed, the model line was marketed between the Corsica and Caprice sedans. The nameplate first saw use in the early 1960s by Oldsmobile, marketing it as a pillared sedan version of the Oldsmobile 88.The Celebrity was among a quartet of vehicles produced on the GM A platform, which transitioned to front-wheel drive for 1982.  Sharing its roofline with the Buick Century, the Celebrity also shared design commonality with the Oldsmobile Cutlass Ciera/Cutlass Cruiser, and the Pontiac 6000.    
After a single generation of the model line was produced, the Celebrity was discontinued after the 1989 model year and replaced by the Lumina; the station wagon was replaced by the Lumina APV minivan after 1990."
1839677.0,0,Chevrolet Celta,"The Chevrolet Celta, also known as Suzuki Fun in Argentina, was a low cost supermini car produced by Chevrolet for the Latin American market since 2000 until 2015. A sedan version is marketed as the Chevrolet Prisma. 600,000 Celtas have been built in Gravataí, more than one hundred thousand per year."
345658.0,0,Chevrolet Chevelle,"The Chevrolet Chevelle  is a mid-sized automobile that was produced by Chevrolet in three generations for the 1964 through 1978 model years. Part of the General Motors (GM) A-body platform, the Chevelle was one of Chevrolet's most successful nameplates. Body styles included coupes, sedans, convertibles, and station wagons. The ""Super Sport"" versions were produced through the 1973 model year, and Lagunas from 1973 through 1976.
After a four-year absence, the El Camino was reintroduced as part of the new Chevelle lineup in 1964.
The A-body Monte Carlo, introduced in 1970, also used a platform that was based heavily on the Chevelle platform, although it was lengthened ahead of the firewall.
The Malibu was the top of the line model through 1972 and completely replaced the Chevelle nameplate starting with the redesigned and downsized 1978 model year."
8660599.0,0,Chevrolet Chevelle Laguna,"The Chevrolet Chevelle Laguna  is a mid-sized automobile produced by Chevrolet for the 1973 through 1976 model years.  Part of the GM A-Body platform, the 1973 Laguna series  included coupes, sedans and station wagons. It was the top-line Chevelle series that year positioned above the Malibu. For 1974 through 1976 the car was produced as a one-model Laguna S-3 coupe, the new-for-1974 Malibu Classic series taking the top-luxury series position. All Lagunas sported urethane front-ends which easily distinguished them from other Chevelles. NASCAR driver Cale Yarborough earned the first two of his three consecutive Winston Cup championships piloting a Chevelle Laguna."
496257.0,0,Chevrolet Chevette,"The Chevrolet Chevette is a front-engine, rear-drive subcompact manufactured and marketed by Chevrolet for model years 1976-1987 as a three-door or five-door hatchback.  Introduced in September 1975, the Chevette superseded the Vega as Chevrolet's entry-level subcompact, and sold 2.8 million units over 12 years. The Chevette was the best-selling small car in the U.S. for model years 1979 and 1980.
The Chevette employed General Motors' global T platform. Worldwide, GM manufactured and marketed more than 7 million T-cars  — rebadged variants using the T platform — including the Pontiac Acadian in Canada, Pontiac T1000/1000 in the United States (1981-1987), K-180 in Argentina, Vauxhall Chevette, Opel Kadett, Isuzu Gemini, Holden Gemini, and as a coupe utility (pickup), the Chevy 500. A T-car variant remained in production in South America through 1998.
Introduced on a full-color nationwide campaign in 140-150 of the country's largest daily papers, the New York Times said the ""little American car holds its own with the foreigners."" Looking back on the Chevette in 2011, the same publication called the Chevette ""haphazardly made, sparsely trimmed and underpowered."" Consumer Guide described the Chevette as “unimaginative to an extreme.”"
1092314.0,0,Chevrolet Chevy II / Nova,"The Chevrolet Chevy II/Nova is a small automobile manufactured by Chevrolet, and produced in five generations for the 1962 through 1979, and 1985 through 1988 model years. Nova was the top model in the Chevy II lineup through 1968. The Chevy II nameplate was dropped after 1968, with Nova becoming the nameplate for all of the 1969 through 1979 models. Built on the X-body platform, the Nova was replaced by the 1980 Chevrolet Citation introduced in the spring of 1979. The Nova nameplate returned in 1985, produced through 1988 as a S-car based, NUMMI manufactured, subcompact based on the front wheel drive, Japan home-based Toyota Sprinter."
36164651.0,0,Chevrolet Chevy Malibu,"The Chevrolet Chevy Malibu was a compact car made by Chevrolet in Argentina from 1968 to 1982. Successor to the Chevrolet 400, the Chevy Malibu offered a more modern body style with better safety features and updated mechanicals.
The car was based on the U.S. market 1968 Chevy II Nova.  Only the 4-door sedan version was manufactured in the country, although U.S. versions included a two-door coupe in addition to the sedan."
17993025.0,0,Chevrolet Cheyenne,"Chevrolet Cheyenne may refer to:

Chevrolet C/K (a trim package for this truck line)
Chevrolet Silverado (post-C/K Silverado marketed in Mexico)
Chevrolet Cheyenne (concept car)"
4246706.0,0,Chevrolet Cheyenne (concept car),"The Chevrolet Cheyenne was a concept car developed by Chevrolet. It was first introduced at the 2003 North American International Auto Show. The Cheyenne had innovative designs not available in production vehicles at the time, such as its side access doors and unique cargo bed. The original Chevrolet Cheyenne truck originated back in 1971 with a production end date of 1998. In 1999 the Silverado was introduced. In 2006, it was spotted in a GM parking lot."
