pageid,ns,title,extract
3189116.0,0,BMW R90S,"The BMW R90S is a 900cc sport motorcycle produced by BMW from 1973 to 1976.  BMW commissioned designer Hans Muth to oversee the R90S, which became the flagship of the boxer engined ""/6"" range.   Sporting distinctive two-tone paintwork, a bikini fairing and a new tail, the R90S was intended to shrug off the enduring image of BMW bikes as staid and utilitarian.
The 67 bhp (50 kW) R90S had a top speed of 124 mph (200 km/h), it ran the quarter mile in around 13.5 seconds and it accelerated from 0 to 62 mph (0–100 km/h) in 4.8 seconds.  Maximum torque was delivered at  5,500 rpm and the engine redlined at 7,200 rpm."
43766998.0,0,BMW R nineT,"The BMW R nineT is a standard motorcycle made by BMW Motorrad since 2014. It is a retro styled roadster marketed by BMW to custom builders and enthusiasts as a ""blank canvas for customizing"".All models have anti-lock braking systems (ABS). Automatic stability control (ASC) is available as an option."
44034606.0,0,BMW S1000R,"The BMW S1000R is a naked motorcycle manufactured by BMW Motorrad since 2014. It is based upon the S1000RR superbike with which it shares its engine, gearbox, frame and suspension.The detuned inline-four engine from the S1000RR is optimized for low to mid range performance and delivers a maximum output of 118 kW (158 hp; 160 PS) at 11,000 rpm and maximum torque of 112 N⋅m (83 lbf⋅ft) at 9,250 rpm."
16977888.0,0,BMW S1000RR,"BMW S1000RR is a race oriented sport bike initially made by BMW Motorrad to compete in the 2009 Superbike World Championship, that is now in commercial production. It was introduced in Munich in April 2008, and is powered by a 999 cc (61.0 cu in) four-cylinder engine redlined at 14,200 rpm.BMW made 1,000 S1000RRs in 2009 to satisfy World Superbike homologation requirements, but expanded production for commercial sale of the bike in 2010. It has a standard anti-lock braking system, with an optional electronic traction control. As of 2016, it has a wet weight of 204 kg (450 lb), and produces 148.4 kW (199.0 hp; 201.8 PS) at 13,500 rpm. With 133.6 kW (179.2 hp; 181.6 PS) to the rear wheel, it was the most powerful motorcycle in the class on the dyno."
57451483.0,0,BMW S1000XR,"The BMW S1000XR is a sport touring motorcycle produced by BMW Motorrad since 2015. The all-rounder motorcycle was presented on 4 November 2014 at the EICMA, Milan, Italy.
The partially faired motorcycle is technically based on the S1000R naked bike and is marketed by the manufacturer as an ""Adventure Sport Bike"". After the fully enclosed sport bikes S1000RR and HP4 as well as the roadster S1000R, the XR is the fourth variant with the inline four-cylinder engine and assembled at the BMW plant in Berlin. The production started on 1 April 2015 and went on sale on 13 June.

"
882090.0,0,BMW S14,"The BMW S14 is a DOHC four-cylinder petrol engine which was used in the E30 M3, E30 320iS, and E36 320i Super Touring. It is based on the BMW M10 block and the cylinder head from the six-cylinder BMW S38 with two cylinders removed. The direct successor to the S14 was the S42 based on the M42 engine. The S42 was a racing engine installed in the E36 320i for the German Super Tourenwagen Cup. There is no direct successor to the S14 for production BMWs, since the following generation of M3 is powered by the BMW S50 six-cylinder engine.
Two separate throttle bodies are used, each incorporating two throttle butterfly plates.

"
882120.0,0,BMW S38,"The BMW S38 is a straight-6 DOHC petrol engine which replaced the M88 and was produced from 1984-1995. The S38 was originally produced for North America as an equivalent to the M88 with slightly lower power output. In 1989, power output of the S38 was increased and it became the worldwide replacement for the M88.
In 1998, the BMW M5 switched to the S62 V8 engine. There is therefore no direct successor to the S38, however the BMW S50 engine took over as BMW's high performance straight-6 engine.

"
10957670.0,0,BMW S65,"The BMW S65 is a naturally aspirated V8 petrol engine which was produced from 2007–2013. Its main use was in the BMW M3 (where it replaced the BMW S54 straight-six engine). There is no direct replacement for the S65, since the following generation of M3 switched to a turbocharged straight-six engine (the BMW S55).
Derived from the BMW S85 V10 engine (as used in the E60 M5), the S65 shares the same basic architecture and aluminium construction. Unlike most other BMW M engines, the S65 and S85 are not related to a regular production BMW engine.The S65 won the International Engine of the Year award for the 3.0 to 4.0 L category in 2008, 2009, 2010, 2011 and 2012."
2877927.0,0,BMW S85,"The BMW S85 is a naturally aspirated V10 petrol engine which replaced the BMW S62 V8 engine in the M5 model and was produced from 2005–2009. It was both BMW's first and only production V10 engine, and the first petrol V10 engine to be available in a production sedan (saloon).
Introduced in the E60 M5, the S85 was inspired by BMW's previous Formula One involvement. Unlike most other BMW M engines, the S85 is not related to a regular production BMW engine.The BMW S65 V8 engine (used in the E92 M3) is based on the S85."
8550257.0,0,BMW Sauber F1.06,"The BMW Sauber F1.06 (or simply BMW F1.06) was the car with which the BMW Sauber team competed in the 2006 Formula One season.  It was driven by Nick Heidfeld, who joined from BMW Williams, and Jacques Villeneuve, who had spent one season with the team before it was bought by BMW.  However, the Canadian was replaced by third driver Robert Kubica before the season finished.  The year marked the first time that BMW had competed as a full team; previously it had only supplied engines.
The chassis was designed by Willy Rampf, Jacky Eeckelaert and Seamus Mullarkey with the powertrain being designed by Heinz Paschen.
The 2006 season was treated as very much a transitional year by the team, so the car's level of competitiveness was a pleasant surprise.  The F1.06 was a contender for points throughout the season, and its form culminated with two podium finishes: one for Heidfeld at the Hungaroring, and the other for Kubica at Monza.
BMW Sauber also developed the car throughout the year, with some sort of improvement available at every race.  The team's innovation even caused controversy: a ""flexible"" rear wing was stiffened early in the season and two vertical pylons in front of the cockpit were banned after an appearance at Magny-Cours.
The team eventually finished fifth in the Constructors' Championship, with 36 points.
The F1.06 car is the last BMW Sauber car to be developed by Sauber due to team transitional."
9056848.0,0,BMW Sauber F1.07,"The BMW Sauber F1.07 is a Formula One single-seater racing car built by BMW Sauber for the 2007 Formula One season. The chassis was designed by Willy Rampf, Walter Reidl, Jörg Zander and Willem Toet with the powertrain being designed by Heinz Paschen. The car was the first to have been designed fully by BMW, following their purchase of the former Sauber team. Initial pre-season testing was very positive, with many speculating that BMW could surprise some of the top teams with their performances when the season got underway."
13481202.0,0,BMW Sauber F1.08,"The BMW Sauber F1.08 was the Formula One racing car used by the BMW Sauber team during the 2008 Formula One season. The chassis was designed by Willy Rampf, Walter Reidl, Christoph Zimmermann and Willem Toet with the powertrain being designed by Markus Duesmann.

"
20057738.0,0,BMW Sauber F1.09,"The BMW Sauber F1.09 was the Formula One car with which the BMW Sauber team competed in the 2009 Formula One World Championship. The car was launched on 20 January 2009 at Circuit de Valencia in Spain. It was driven by Poland's Robert Kubica and Germany's Nick Heidfeld, both retained from 2008. The chassis was designed by Willy Rampf, Walter Reidl, Christoph Zimmermann and Willem Toet with the powertrain being designed by Markus Duesmann.
After the team's impressive performance in 2008, winning their first race and coming third in the championship, much was expected of them. BMW made a promising start to the season, with Kubica running second at Melbourne and lapping faster than the leader before retiring in a collision, and Heidfeld finishing second at the chaotic Malaysian GP. However, the F1.09 ultimately proved to be disappointing. At times, the drivers could barely scrape through to Q2, let alone challenge for pole. Both drivers expressed discontent with the slow developments to the car. Towards the end of the season things began to look up, with the cars managing fourth and fifth at Spa-Francorchamps and Kubica finishing second at Brazil. However, the damage had been done, and BMW announced that 2009 would be their last season in Formula One. The team eventually finished sixth in the Constructors' Championship."
63285687.0,0,BMW South Africa,"BMW South Africa (Pty) Ltd. is an automobile manufacturer based in Rosslyn, South Africa. The company is part of the BMW group."
18165300.0,0,BMW Tennis Championship,"The BMW Tennis Championship was a professional tennis tournament played on outdoor hard courts. It was part of the Association of Tennis Professionals (ATP) Challenger Tour. It was held annually at the Sunrise Tennis Club in Sunrise, Florida, United States, from 2004 until 2010 and was replaced with the Dallas Tennis Classic."
33413261.0,0,BMW Track Trainer,The BMW Track Trainer is a modified BMW 330i that can negotiate a race track autonomously at the limit of traction. It was conceived as a driver training tool that allows a new student to experience the ideal race line from the driver's seat. The vehicle is a research project from BMW Group Research and Technology (BMW Forschung und Technik GmbH).
4420479.0,0,BMW Turbo,"The E25 Turbo concept sports car was built by BMW as a celebration for the 1972 Summer Olympics in Munich. It was designed by Paul Bracq, with gullwing doors and was based on a modified 2002 chassis with a mid-mounted engine.  The Turbo featured a 276 hp turbocharged version of the engine from the BMW 2002, foam-filled front and rear sections to absorb impact, side impact beams, a braking distance monitor utilizing radar, and a futuristic cockpit. The car developed 206 kW (280 PS; 276 hp) at 7100 rpm and could reach 100 km/h (62 mph) from a standstill in 6.6 seconds. The top speed was 250 km/h (155 mph).Only two were ever built. BMW later used the Turbo's design themes on the M1, the 8 Series, the Z1 and the 2008 M1 Homage Concept. The BMW E-25 is however most similar to the BMW M1."
43787094.0,0,BMW Type 255,"BMW Type 255 Kompressor (also known as the  500 Kompressor, RS 255, RS255 and Type 255 RS 500) was a supercharged boxer twin race motorcycle from the 1930s.  A BMW 255 Kompressor was ridden to victory by Georg Meier in the 1939 Isle of Man TT and the first win by a non-British competitor in the premier 500cc Senior TT class.   A similar BMW 255 Kompressor  machine was auctioned in 2013 for US$480,000, the second-highest price ever paid at auction for a motorcycle."
42866973.0,0,BMW UKL platform,"The UKL platform (Untere Klasse, ""lower class"" in German) is a modular automobile platform developed by German car manufacturer BMW. It is a modular architecture to suit a range of front-wheel-drive and all-wheel drive models.
The objective of the front-wheel-drive UKL platform is to offer smaller models with a large interior space, with enough room for passengers in the rear seats and large cargo space. These objectives are only possible to achieve by mounting transverse three or four-cylinder engines. At the time of release, BMW announced that any model under 4.5 m (177 in) in length and smaller than a 3 Series will make use of the UKL platform. According to Ian Robertson, BMW sales and marketing chief, ""One of the big advantages of UKL is that we are able to launch a lot of products almost simultaneously because we are doing the engineering at once.""The platform has two derivatives: the UKL1 and UKL2. The first production vehicle to use the UKL platform is the 2014 Mini Hatch. Another UKL platform derivative is the FAAR platform which was announced in 2017. It is designed with pure ICE, hybrid and electric powertrains in mind."
10579771.0,0,BMW V,"The BMW V was a six-cylinder, water-cooled inline aircraft engine built in Germany in the 1920s, with power of 240 kW (320 hp) for the production version, the BMW Va."
9455026.0,0,BMW V12,"BMW V12 may refer to:

Multiple V12 engines built by BMW since 1986, named the M70, M73, N73 or N74.
A series of sports cars run by BMW Motorsport known as the V12 LM and V12 LMR."
9471199.0,0,BMW V12 LM,"The BMW V12 LM was a racing car built for sports car racing in 1998.  The car was built using a combination of WilliamsF1 engineering and construction and a BMW powerplant.  The car was a predecessor to the BMW V12 LMR, which debuted in 1999."
3537574.0,0,BMW V12 LMR,"The BMW V12 LMR is a Le Mans Prototype built for sports car racing from 1999 to 2000. The car was built through an alliance between BMW Motorsport and WilliamsF1, and was the successor to the failed BMW V12 LM of 1998.  It is famous for earning BMW its only overall victory to date at the 24 Hours of Le Mans."
10582562.0,0,BMW VI,"The BMW VI was a water-cooled V-12 aircraft engine built in Germany in the 1920s. It was one of the most important German aero engines in the years leading up to World War II, with thousands built. It was further developed as the BMW VII and BMW IX, although these saw considerably less use. It was also produced in the Soviet Union as the M-17 and Japan as the Kawasaki Ha-9."
13253130.0,0,BMW VII,"The BMW VII was a water-cooled twelve-cylinder engine derived from the successful BMW VI. The engine was not as popular as the VI, due in no small part to the Great Depression, and only a small number were built. Experiments with supercharging led to the related BMW IX.

"
30853500.0,0,BMW Vision ConnectedDrive,"The Vision ConnectedDrive is a two-seater sports car concept built by BMW featuring new advanced driver assistance aids. It had its world premiere at the 2011 Geneva Motor Show. Unlike previously named Vision concept cars, BMW has no intention to build this vehicle, but to show off its latest design and technology developments.

"
43801523.0,0,BMW WR 750,"The BMW WR 750 was a supercharged racing motorcycle from BMW with two-cylinder, four-stroke flat twin engine starting production in the year 1929."
10569579.0,0,BMW Welt,"The BMW Welt is a combined exhibition, delivery, adventure museum, and event venue located in Munich's district Am Riesenfeld, next to the Olympic Park, in the immediate vicinity of the BMW Headquarters and factory. It was built from August 2003 to summer 2007. A solar system with 800 kW of power is installed on the roof of the main building. The opening took place on 17 October 2007. The BMW Welt is the most visited tourist attraction in Bavaria."
21704332.0,0,BMW X,"BMW X may refer to the following BMW crossovers, SUVs, and SACs:

BMW X1 (SUV based on 1 Series platform)
BMW X2 (SUV based on 1 Series platform)
BMW X3 (SUV based on 3 Series platform)
BMW X4 (SUV with Coupé roofline, based on X3 platform)
BMW X5 (SUV based on 5 Series platform)
BMW X6 (SUV with Coupé roofline, based on X5 platform)
BMW X7 (SUV based on 7 Series platform)"
18186440.0,0,BMW X-Coupe,"The X-Coupe was a concept crossover coupe designed by Chris Bangle for BMW, debuting at the 2001 North American International Auto Show in Detroit. Based upon the BMW X5 chassis, the X-Coupe featured an aluminium body and a 3.0 litre turbo-diesel engine.  Unlike the BMW X5, the X-Coupe had an aluminium body, a trunk opening downwards and two doors that swing outward."
18964684.0,0,BMW X1,"The BMW X1 is a line of subcompact luxury crossover SUV produced by BMW. Debuted in 2009, the first-generation X1 has been based on the E90 3 Series and offers rear-wheel drive layout as standard. At its introduction, it was positioned as the smallest SUV in BMW line-up below the X3, aiming a wider range of customers due to its smaller size, increased efficiency, and a lower price tag due to the all-wheel drive layout (xDrive) being optional.
The second-generation X1 marked the switch to the front-wheel drive-based layout by using the UKL2 platform shared with the BMW 2 Series Active Tourer and the Mini Countryman. Despite its name, it is currently only the second smallest SUV produced by BMW since the introduction of the X2.

"
57650601.0,0,BMW X1 (E84),"The E84 BMW X1 is a subcompact luxury crossover SUV and was produced from 2009 to 2015. It is the first generation model of the BMW X1 range, and was replaced by the F48 BMW X1 in mid-2015.

"
57650603.0,0,BMW X1 (F48),"The F48 BMW X1 is the second and current generation of the BMW X1 range of subcompact luxury crossover SUV. The F48 X1 was unveiled at the 2015 Frankfurt Motor Show in September 2015, and later at the 2015 Tokyo Motor Show. Contrary to the previous generation which uses rear-wheel drive as standard, all models are now front-wheel drive based (marketed as sDrive) while also available with an optional all-wheel drive (xDrive)."
35901792.0,0,BMW X2,"The BMW X2 (model code F39) is a subcompact luxury crossover SUV produced by BMW. It was first showcased as the BMW Concept X2 at the 2016 Paris Motor Show, with a production version unveiled in October 2017. Sales commenced in March 2018. It is considered a sportier and less practical alternative to the X1, as it is the case with other even-numbered X models with its respective counterparts.

"
1527538.0,0,BMW X3,"The BMW X3 is a compact luxury crossover SUV manufactured by German automaker BMW since 2003. Based on the BMW 5 Series (G01) or BMW CLAR platform. Now in its third generation, BMW markets the crossover as a Sports Activity Vehicle, the company's proprietary descriptor for its X-line of vehicles.
The first-generation X3 was designed by BMW in conjunction with Magna Steyr of Graz, Austria—who also manufactured all X3s under contract to BMW. BMW manufactured the second-generation X3 at their Spartanburg plant in South Carolina, United States. The third-generation of the BMW X3 is manufactured at BMW South Africa's Rosslyn plant, a facility that underwent a major upgrade to prepare for the X3 production, replacing the long-running 3 Series production in the plant. About 76,000 units will be manufactured there annually.It was considered as the first mid-size, premium SUV on the market. Only since 2008, X3 started competing with the Mercedes-Benz GLK-Class (renamed GLC-Class since 2016), and numerous other SUVs in this segment. Currently, it slots below the larger X5 and X6, and above the smaller X1 and the X2.
An all-electric variant is sold as the BMW iX3."
27908383.0,0,BMW X4,"The BMW X4 is a compact luxury crossover SUV manufactured by BMW since 2014. It is marketed as a sports activity coupé (SAC), the second model from BMW marketed as such after the X6, and features styling elements and the roofline of a traditional two-door coupé. The X4 is widely considered as a ""coupé"" version of the X3, trading its practicality with a sloping rear roof which offers a sportier styling.

"
956354.0,0,BMW X5,"The BMW X5 is a mid-size luxury crossover SUV produced by BMW. The X5 made its debut in 1999 as the E53 model. It was BMW's first SUV. At launch, it featured all-wheel drive and was available with either a manual or automatic gearbox. The second generation was launched in 2006, and was known internally as the E70. The E70 featured the torque-split capable xDrive all-wheel drive system mated to an automatic gearbox. In 2009, the X5 M performance variant was released as a 2010 model.BMW marketed the X5 officially as a ""Sports Activity Vehicle"" (SAV), rather than an SUV, to indicate its on-road handling capability despite its large dimensions. The X5 signaled a shift away from the utilisation of body-on-frame construction, in favour of more modern monocoque chassis construction. Although the Mercedes-Benz M-Class was introduced more than a year prior to the X5, the X5 was the first to utilise a monocoque chassis. The M-Class used body-on-frame construction until its second generation.The X5 is primarily manufactured in North America, at BMW Group Plant Spartanburg. Assembly operations also take place in Russia by Avtotor, along with operations in India, Indonesia, Malaysia, and Thailand. The X5 is also modified for armoured security versions, at the BMW de México Toluca plant.The automaker's SAV series, which was created by the X5, has expanded with derivations of other number-series BMWs. This began in 2003 with the X3, and continued in 2008 with the X6 (which shares its platform with the X5)."
882209.0,0,BMW X5 (E53),"The BMW E53 is the first generation BMW X5 mid-size luxury crossover SUV. The vehicle was the first SUV ever produced by BMW. It was produced between 1999 and 2006 and was replaced by the E70 X5. 
The E53 X5 was developed just after the acquisition of Land Rover by BMW. As such, the vehicle shares many components and designs with both the Range Rover L322 model (specifically the hill descent system and off road engine management system) and the BMW E39 5 Series (specifically engines and electronic systems). The entire in-car entertainment system (radio function, navigation system, television and telecommunications systems) are shared with other BMWs and L322. As a result, the earlier X5 models can be upgraded with newer BMW technologies (e.g. Bluetooth phone connectivity)."
882211.0,0,BMW X5 (E70),"The BMW E70 is the second-generation BMW X5 mid-size luxury crossover SUV. It replaced the BMW X5 (E53) in July 2006. It was manufactured alongside the BMW X6 at BMW's Greer, South Carolina plant in the U.S. and BMW's facility in Toluca, Mexico."
39527602.0,0,BMW X5 (F15),"The BMW X5 (F15) is a mid-size luxury SUV manufactured and marketed worldwide by BMW since 2013. The car was unveiled in the 2013 Frankfurt International Motor Show. Early X5 models include xDrive50i, xDrive30d, M50d. BMW xDrive40d, xDrive35i, xDrive25d, sDrive25d were to be added in December 2013.The X5 arrived in US showrooms in the fourth quarter of 2013. Early models include sDrive35i, xDrive35i, xDrive50i, followed by xDrive35d in early 2014, and the xDrive40e, a plug-in hybrid variant in 2015.

"
58196450.0,0,BMW X5 (F85),"The BMW X5 M (F85) is a mid-size luxury SUV that is based on the BMW X5 (F15) which has been built by BMW since 2014. Unlike the BMW X5 M50d the X5 M is a full BMW M series car that has the M Powered engine. In comparison, the M50d is classified as an ""M Performance Car"" which means it isn't a full M car unlike the BMW M3 or the BMW M5.
Its S63B44T2 4.4 liter V8 engine has 575 hp (429 kW) and 553 lb⋅ft (750 N⋅m) of torque, making it the most powerful engine ever developed for an all-wheel drive BMW. The engine has M TwinPower Turbo and Valvetronic technologies, to deliver a 0–100 km/h (62 mph) time of 4.2 seconds.An M-tuned xDrive all-wheel drive system provides traction. It distributes drive between the front and rear axles, while Dynamic Performance Control distributes torque between the 21-inch M Double-spoke light-alloy wheels—all for dynamic driving and all-road capability."
57616030.0,0,BMW X5 (G05),"The G05 BMW X5 is a mid-size luxury SUV produced by German automaker BMW. It is the fourth, and current, generation of the BMW X5. It was launched in 2018 as the successor to the F15 X5. Sales of the X5 started in November 2018. The X5 M and X5 M Competition performance models were revealed on 1 October 2019."
8205912.0,0,BMW X6,"The BMW X6 is a mid-size luxury crossover SUV by German automaker BMW. The BMW X6 is the originator of the sports activity coupé (SAC), referencing its sloping rear roof design. It combines the attributes of an SUV (high ground clearance, all-wheel drive and all-weather ability, large wheels and tires) with the stance of a coupé (styling featuring a sloping roof). It is built in BMW's North American plant in Greer, South Carolina alongside the BMW X5, whose platform it shares. Prior to the release of the X7, the X6 was considered a flagship SUV for BMW.
The first generation (E71) was released for sale in April 2008 for the 2008 model year, while the second-generation X6 (F16) was launched at the Paris Motor Show in 2014. The third-generation X6 was revealed in July 2019."
42328161.0,0,BMW X7,"The BMW X7 is a full-sized luxury crossover sport utility vehicle manufactured by BMW. It is BMW's largest and most expensive SUV in its line-up.The X7 was first announced by BMW in March 2014. It was officially unveiled on October 17, 2018, with pre-orders being taken online. The X7 has been available at dealers since March 2019."
13423655.0,0,BMW X (engine),"The BMW X was a small five-cylinder radial engine for sport and training aircraft. Although this engine proved successful at several large-scale events in 1930, including that year's round-Europe flight, only a few were built.
The successor model to the BMW X five-cylinder radial engine, the BMW Xa, was introduced in 1931, with the swept volume increased from 2.2 l (130 cu in) to 2.9 l (180 cu in). Power output went up from 37 to 51 kW (50 to 68 hp). The Xa was also not built in any quantity and was mainly installed in training and sport aircraft."
