pageid,ns,title,extract
142314.0,0,Acura,"Acura is the luxury and performance division of Japanese automaker Honda. The brand was launched in the United States and Canada on March 27, 1986, marketing luxury and performance automobiles. It was introduced to Hong Kong in 1991 (lasting until 2009), Mexico in 2004, China in 2006, Russia in 2014 (no longer available in Russia), Kuwait in 2015, and was also sold in Ukraine (until 2018). Honda's plan to introduce Acura to the Japanese domestic market (JDM) in 2008 was delayed, due to economic reasons, and later withheld as a result of the financial crisis of 2007–2008.Acura is the first Japanese automotive luxury brand. The creation of Acura coincided with the introduction of a JDM Honda dealership sales channel, called Honda Clio, which sold luxury vehicles, joining previously established Honda Verno, followed by Honda Primo the following year. In its first few years of existence, Acura was among the best-selling luxury marques in the US, outselling established brands such as BMW and Mercedes-Benz. Though sales were down in the mid-to-late 1990s, the brand experienced a revival in the early 2000s, due to drastic redesigns and the introductions of new models.In the late 1980s, the success of the company's first flagship vehicle, the Legend, inspired fellow Japanese automakers Toyota and Nissan to launch their own luxury brands, Lexus and Infiniti, respectively. The 1990 launch of the NSX, a mid-engine exotic sports car, offered a reliable and practical alternative to exotic European sports cars, and introduced Honda's VTEC variable valve timing system to the North American market. The 1993 Legend coupé featured Acura's first use of a six-speed manual transmission mated to a Type II engine. In the late 1990s, Acura produced a Type R version of its compact Integra, which featured a reduced curb weight, a stiffer and lower suspension, and a high-output VTEC engine.
In the early 2000s, Acura introduced new models, including the company's first all-original SUV, the MDX, and two models which replaced the Integra coupé and sedan, the RSX and TSX, respectively. Type-S versions of the RSX, CL, and TL were added to the brand's lineup during that decade. Acura's 2005 RL flagship introduced SH-AWD, a torque-vectoring all-wheel drive system. The 2007 RDX, a crossover SUV, featured the first North American use of a turbocharged Honda engine. A second generation NSX was launched in 2016 and features a twin-turbocharged mid-engine, a nine-speed dual-clutch transmission, and Sport Hybrid SH-AWD.

"
57764329.0,0,Acura A-Spec and Type-S models,"The A-Spec and Type-S marques represent the high-performance divisions of cars produced by Acura. Acura utilized the Type R marque for their high-performance division of cars from 1997 to 2001, when they produced the Acura Integra Type R. The first vehicle offered as a Type-S variant was the 2001–2003 Acura CL, and the first vehicle offered as an A-Spec variant was the 2003 Acura TL in Canada and the 2004 Acura RSX in the US."
10431702.0,0,Acura ARX-01,"The Acura ARX-01, later known as the HPD ARX-01 is a series of Le Mans Prototype built for sports car racing, specifically in the American Le Mans Series, Le Mans Series, and at the 24 Hours of Le Mans.  It is the first purpose-built race car by the Acura division of Honda Motor Company, part of their multi-year program to eventually compete in endurance race.  The car debuted in 2007 in the American Le mans Series before expanding to customers in Europe.  Over the years various specifications of the ARX-01 chassis have been developed, each signified by a letter suffix.  In 2010 Acura withdrew their name from the program and Honda Performance Development which developed the car for Acura continued the program into 2011."
21647990.0,0,Acura ARX-02a,"The Acura ARX-02a was a Le Mans Prototype constructed by Acura for competition in the LMP1 category of the American Le Mans Series.  It was Acura's second Le Mans Prototype, following their ARX-01 which competed in the LMP2 category."
60482282.0,0,Acura ARX-05,"The Acura ARX-05 is a sports prototype racing car built to Daytona Prototype International regulations. It was developed in partnership by Honda Performance Development and Oreca, and is based on the Oreca 07 chassis and powered by the Acura AR35TT twin-turbocharged 3.5L V6 engine.The car made its racing debut at the 2018 24 Hours of Daytona with Team Penske. In 2019, the car won the drivers', teams' and manufacturers' titles in the top DPi class of the IMSA WeatherTech SportsCar Championship, becoming the first non-General Motors car to do so. Acura and Team Penske successfully defended their titles in 2020, winning all of the DPi class championships.It was announced in July 2020 that the partnership between Team Penske and Honda Performance Development would not be renewed for the 2021 season. For the 2021 season, Wayne Taylor Racing and Meyer Shank Racing campaigned one of the ARX-05s previously run by Penske. Both teams continued using the model for the 2022 season."
50321171.0,0,Acura CDX,"The Acura CDX is a subcompact luxury crossover SUV produced by Acura, a luxury vehicle division of Honda. The car made its debut at the Beijing Auto Show in April 2016. The CDX is produced at the Zengcheng Plant in Guangzhou, China and has been available since July 2016."
700235.0,0,Acura CL,"The Acura CL is a midsize grand tourer manufactured by Honda's Acura brand from 1996 to 1999, and from 2000 to 2003. The CL is often thought to have been a replacement for the Acura Legend coupe.  It was not directly related to the first gen TL either, a Japanese-built model which replaced the Vigor and had a longitudinal engine layout. With the advent of the 2nd gen TL in 1999, the transverse engined CL became more precisely a TL coupe. All Acura CLs were built at Honda's plant in East Liberty, Ohio, which is also the plant that builds the Honda Civic.  The 2nd genTL and the Honda Accord upon which the Acura CLs were based, are built at Honda's plant in Marysville, Ohio, a few miles away from East Liberty. The CL was the first Acura to be built in the United States.
Following the end of the 1995 model year, the Acura Legend coupe disappeared from Acura's lineup when the sedan version was renamed the Acura RL. The CL was not a direct replacement for the Legend coupe as it no longer shared the same chassis as its sedan counterpart, and was not made in Japan, unlike the RL. Because Acura no longer had a suitable Legend coupe replacement, they created this vehicle. With the release of the TL and 3.5RL in 1996, Acura transitioned to alphanumeric and/or two-letter names, naming of all of its vehicles (with the exception of the Integra, which kept its name until the 2001 model year). Although the CL was considered to be a satisfactory vehicle, it never gained traction or popularity like the other Acura coupes."
60463315.0,0,Acura CL-X,The Acura CL-X is a concept car built by Acura (in conjunction with its parent company Honda) for the 1995 North American International Auto Show in Detroit. It was reported to have a top speed of 140 mph (225 km/h). The particular car shown had special carbon fiber and aluminum composite wheels designed for performance.
3161370.0,0,Acura CSX,"The Acura CSX is Acura's subcompact executive car exclusively designed for the Canadian market. The CSX is the first Acura model with two predecessors, the Integra sedan (1986–1996) and the EL (1997–2005). Like the EL, it was only available in Canada and built in Alliston, Ontario, Canada. For the 2013 model year, the ILX was introduced as the CSX's replacement and is available in both the United States and Canada."
598171.0,0,Acura EL,"The Acura EL is a subcompact executive car that was built at Honda's Alliston, Ontario, plant, and also the first Acura built in Canada. It’s also exclusively sold in Canada. The EL is a badge-engineered Honda Civic with a higher level of features. There is no Type-S trim offered on both Acura ELs.
The Acura EL was a sales success. Representing 51% of Acura Canada's annual new-vehicle sales in its first full year, the EL remained Acura's top seller in Canada from 1997 to 2003.  The Acura EL was replaced for the 2006 model year by the Acura CSX which, like the EL, was available only in Canada."
34034631.0,0,Acura ILX,The Acura ILX is a subcompact executive car (C) produced by Honda under the Acura brand. All ILX variants are based upon the ninth-generation Civic sedan. The ILX replaced the Canadian market exclusive Acura CSX.  The ILX was also Acura's first gasoline-electric hybrid vehicle.
947730.0,0,Acura Legend,"The Acura Legend is a mid-size luxury/executive car manufactured by Honda from Japan. It was sold in the U.S., Canada, under Honda's luxury brand, Acura, from 1985 until 1995, as both a sedan, which was classified as a full-size car,and a coupe, which was classified as a mid-size car (similar to how the Honda Accord is set up today). It was the first flagship sedan sold under the Acura nameplate, until being renamed in 1996 as the Acura 3.5RL. The 3.5RL was the North American version of the KA9 series Honda Legend.
The opportunity for Japanese manufacturers to export more expensive models had arisen with the 1980s voluntary export restraints, negotiated by the Japanese government and U.S. trade representatives, restricting mainstream car sales. The initial success of the Legend and Honda's Acura division in competing against established European and American luxury manufacturers would lead to Toyota and Nissan creating the Lexus and Infiniti brands, respectively, to compete in the luxury car market."
598144.0,0,Acura MDX,"The Acura MDX is a three-row mid-size luxury crossover SUV produced by the Japanese automaker Honda under its Acura luxury nameplate since 2000. The alphanumeric moniker stands for ""Multi-Dimensional luxury"". It has ranked as the second-best selling mid-size luxury SUV after the Lexus RX.The MDX was the first crossover SUV to have third-row seating, and shares its platform with the Honda Pilot. The Pilot is available with a seven or eight person seating configuration, while the MDX exclusively seats seven, with two seating positions in the third row. The MDX was introduced on October 5, 2000 as a 2001 model, replacing the slow-selling U.S.-only body-on-frame SLX, based on the Isuzu Trooper. In Japan, it was made to replace the Honda Horizon (also based on the Trooper) which was discontinued in 1999. In 2003, the vehicle went on sale in Japan and Australia as the Honda MDX; sales with Honda badges ended with the introduction of the second generation three years later."
41910481.0,0,Acura Pharmaceuticals,"Acura Pharmaceuticals Inc. is a pharmaceutical company focused on the development and commercialization of deterrents to medication abuse and misuse. As of 2012, the company had several opioid products under development, which would use ""Aversion Technology"".  As of 2014, it was a publicly traded company, listed on NASDAQ under the symbol ""ACUR"".

"
1741361.0,0,Acura RDX,"The Acura RDX is Acura’s first compact luxury crossover SUV. The RDX was initially built upon the same platform Honda uses for its Civic and CR-V passenger cars.  However starting from its third generation, the Acura RDX is built on its own platform according to Acura."
670227.0,0,Acura RL,"The Acura RL is a mid-sized / executive luxury car that was manufactured by the Acura division of Honda for the 1996–2012 model years over two generations. The RL was the flagship of the marque, having succeeded the Acura Legend, and was replaced in 2013 by the Acura RLX. All models of the Legend, RL and RLX lines have been adapted from the Japanese domestic market Honda Legend. The model name ""RL"" is an abbreviation for ""Refined Luxury.""The first-generation Acura RL was a rebadged version of the third-generation Honda Legend, and was first introduced to the North American market in 1996, to replace the second-generation Acura Legend. The second-generation Acura RL was a rebadged version of the fourth-generation Honda Legend, introduced to the North American market in September 2004, as a 2005 model. This iteration of the RL received an extensive mid-generational facelift for the 2009 model year, and a further update for 2011. The third-generation debuted for the 2014 model year as the Acura RLX."
36984104.0,0,Acura RLX,"The Acura RLX is an executive car manufactured by Honda and sold under their Acura division, released in 2013, succeeding the RL. The RLX was discontinued in 2020."
489379.0,0,Acura TL,"The Acura TL is an executive car that was manufactured by Acura, the luxury division of Honda. It was introduced in 1995 to replace the Acura Vigor and was badged for the Japanese-market from 1996 to 2000 as the Honda Inspire and from 1996 to 2004 as the Honda Saber. The TL was Acura's best-selling model until it was outsold by the MDX in 2007. In 2005, it ranked as the second best-selling luxury sedan in the United States behind the BMW 3 Series, but sales decreased after the 2008 model year. Four generations of the Acura TL were produced, with the final fourth generation TL premiering in 2008 as a 2009 model and ending production in 2014, when it was replaced together with the TSX by the TLX."
41655361.0,0,Acura TLX,"The Acura TLX is a compact executive car sold by Acura, the luxury division of Honda, since 2014. It is the successor to both the TL and TSX models. As of 2021, the discontinuation of the RLX leaves the TLX as the flagship sedan in Acura's lineup."
409525.0,0,Acura TSX,"The Acura TSX is a compact executive car manufactured by Honda and sold through its Acura division from 2003 to 2014. The TSX spanned two generations, both derived from the corresponding Japanese/European versions of the Honda Accord, which were more compact and sporting-oriented than its larger North American counterpart.The first-generation TSX was introduced as a 2004 model in April 2003  as a rebadged version of the Japanese domestic market (JDM) Honda Accord 2.4 Type-S, with the exception of its interior, borrowed from the JDM fourth-generation Honda Inspire. It was succeeded by the second-generation TSX, introduced in March 2008 as a 2009 model and based on the eighth-generation JDM Accord. Notably, the final generation of the TSX would introduce a V6 option for 2010, and a wagon for 2011.
It was sold in North America under the Acura luxury marque, where it filled the gap as Acura's 4-door, entry-level sedan when the Integra sedan was discontinued in 2001 (1996 in Canada since the EL was the Integra sedan's replacement there) and would become Acura's entry-level vehicle when the Acura RSX was discontinued in 2006. From the 2007 model year until 2013, the TSX was the smallest vehicle in the Acura model line, other than the Civic-based CSX and the preceding Acura 1.6 and 1.7 EL sold only in Canada. In 2013, the smaller ILX was introduced in both the United States and Canada, based upon the Civic platform (replacing the CSX in Canada).  All TSXs were built in Sayama, Saitama, Japan.
Honda discontinued the TSX and the larger TL during 2014 with the introduction of the TLX, which replaced both vehicles."
22065980.0,0,Acura ZDX,"The Acura ZDX is a mid-size luxury crossover SUV with a sloping rear roofline developed by Honda for its upmarket brand Acura. The car was originally planned to be called the ""MSX"". The ZDX debuted at the 2009 New York International Auto Show on April 8, 2009, as a 2010 model.  The vehicle was also the first to be completely designed at Acura's southern California design studio in Torrance.
The original ZDX concept was penned by Michelle Christensen who labeled it a ""4-door luxury sports coupe"" and which Acura says ""blurs the distinction between coupe, sedan and sport utility vehicle.""The ZDX features Acura's first six speed automatic transmission, advanced ventilated seats, as well as other luxury appointments. Although the ZDX shares a similar profile with the Honda Crosstour, the two vehicles are not mechanically related: the latter is based on the Honda Accord, while the ZDX is based on the Honda Pilot/Acura MDX."
23459030.0,0,Acurauá River,"The Acurauá River (Portuguese: Rio Acurauá  is a river of Acre and Amazonas states in western Brazil. It is a tributary of the Tarauacá River.

"
19039341.0,0,AUDIX,"AUDIX (AUDio Information EXchange) is a voicemail server intended to be used with a Lucent/Avaya private branch exchange (PBX).  AUDIX features many integrations with Avaya PBXes, such as capturing the extension of the calling party and announcing that person's name (if they're also an AUDIX subscriber and have recorded their name on the system) when announcing the attributes of a message, automatic identification of subscribers when they are dialing in to retrieve their messages, and activating and deactivating message-waiting indicators.It can also serve as a recording device.  A subscriber with an appropriately administered feature button on their phone can press said button and within a few seconds, the station will be conferenced with AUDIX and AUDIX will record the conversation.  The recording will be stored like a voice mail.
AUDIX systems are based on Unix, and share some software with Avaya's Conversant interactive voice response (IVR) platform.  Early forms of unified messaging appeared in the late 1980s; earlier AUDIX releases interoperated with System V mail servers and with System 85 PBXes, when AT&T still owned UNIX.  Many of the same status and control programs are used to operate AUDIX and Conversant systems, but an AUDIX system is geared specifically to serving up voicemail and is not a general IVR platform.

"
848.0,0,Audi,"Audi AG (German: [ˈaʊ̯di ʔaːˈɡeː] (listen)) (commonly referred to as Audi) is a German automotive manufacturer of luxury vehicles headquartered in Ingolstadt, Bavaria, Germany. As a subsidiary of its parent company, the Volkswagen Group, Audi produces vehicles in nine production facilities worldwide.
The origins of the company are complex, going back to the early 20th century and the initial enterprises (Horch and the Audiwerke) founded by engineer August Horch; and two other manufacturers (DKW and Wanderer), leading to the foundation of Auto Union in 1932. The modern era of Audi essentially began in the 1960s when Auto Union was acquired by Volkswagen from Daimler-Benz. After relaunching the Audi brand with the 1965 introduction of the Audi F103 series, Volkswagen merged Auto Union with NSU Motorenwerke in 1969, thus creating the present-day form of the company.
The company name is based on the Latin translation of the surname of the founder, August Horch. Horch, meaning ""listen"" in German, becomes audi in Latin. The four rings of the Audi logo each represent one of four car companies that banded together to create Audi's predecessor company, Auto Union. Audi's slogan is Vorsprung durch Technik, meaning ""Being Ahead through Technology"". Audi, along with fellow German marques BMW and Mercedes-Benz, is among the best-selling luxury automobile brands in the world."
848.0,0,Audi,"Audi AG (German: [ˈaʊ̯di ʔaːˈɡeː] (listen)) (commonly referred to as Audi) is a German automotive manufacturer of luxury vehicles headquartered in Ingolstadt, Bavaria, Germany. As a subsidiary of its parent company, the Volkswagen Group, Audi produces vehicles in nine production facilities worldwide.
The origins of the company are complex, going back to the early 20th century and the initial enterprises (Horch and the Audiwerke) founded by engineer August Horch; and two other manufacturers (DKW and Wanderer), leading to the foundation of Auto Union in 1932. The modern era of Audi essentially began in the 1960s when Auto Union was acquired by Volkswagen from Daimler-Benz. After relaunching the Audi brand with the 1965 introduction of the Audi F103 series, Volkswagen merged Auto Union with NSU Motorenwerke in 1969, thus creating the present-day form of the company.
The company name is based on the Latin translation of the surname of the founder, August Horch. Horch, meaning ""listen"" in German, becomes audi in Latin. The four rings of the Audi logo each represent one of four car companies that banded together to create Audi's predecessor company, Auto Union. Audi's slogan is Vorsprung durch Technik, meaning ""Being Ahead through Technology"". Audi, along with fellow German marques BMW and Mercedes-Benz, is among the best-selling luxury automobile brands in the world."
56962773.0,0,Audi (song),"""Audi"" is a song by American rapper Smokepurpp. It was released on May 17, 2017, as the lead single from his debut mixtape Deadstar. The track is considered one of his breakout singles, along with ""Ski Mask""."
619565.0,0,Audi 100,"The Audi 100 and Audi 200 (and sometimes called Audi 5000 in North America) are primarily mid-size/executive cars manufactured and marketed by the Audi division of the Volkswagen Group. The car was made from 1968 to 1997 across four generations (C1–C4), with a two-door model available in the first and second generation (C1-C2), and a five-door model available in the last three generations (C2–C4).
In 1982, the third generation Audi 100 achieved a remarkably low (for its time) drag coefficient of 0.30, featuring flush greenhouse sides with unique sliding window mountings.
The C2 and C3 models of the Audi 100 were marketed in North America as the Audi 5000 from 1984 to 1988, and in South Africa as the Audi 500.
In 1994, the models were mildly restyled, and renamed the Audi A6 series in conjunction with a general new Audi naming scheme, until they were relieved by a new generation of A6, internally code-named C5, in 1997."
9573624.0,0,Audi 100 Coupé S,"The Audi 100 Coupé S is a sports fastback coupe Grand tourer class car manufactured by the German automaker Audi AG. The car was first presented at the Frankfurt Motor Show in 1969. Originally 30,687 units were produced."
917563.0,0,Audi 50,"The Audi 50 (known internally as the Typ 86) is a supermini economy car produced by German automaker Audi from 1974 to 1978, and sold only in Europe. Introduced two or three years after the Italian Fiat 127 and the French Renault 5, the model was seen at the time as Germany's first home grown entrant in Europe's emerging ""supermini"" class.The Audi 50 was built by Audi NSU Auto Union AG at the former NSU factory in Neckarsulm, Germany, and at the giant Wolfsburg plant by Volkswagen. The car was rebadged six weeks later by Volkswagen as the Volkswagen Polo with a wider range of engine and other options. The Volkswagen Polo was launched in the home market in September 1974 and appeared in export markets, including the United Kingdom, a few months later.
The car was offered as a three door hatchback with a 1,093 cc (66.7 cu in) petrol engine, producing either 37 kW (50 PS; 50 bhp) or 44 kW (60 PS; 59 bhp) for the LS and GL models, respectively. The model was popular in Europe, both because of its generous specifications for a car of the time, and on account of its relatively low price. The Volkswagen and Audi badged models were sold alongside each other for three years until 1978, but the cheaper Volkswagen Polo outsold the Audi 50 almost immediately, and Audi discontinued the Audi 50 in 1978, after a total production of 180,812 units. A planned facelift, which would have given the Audi 50 a look closer to that of the Audi 100 and Audi 80 was never implemented, because of a holding company board decision that the Audi brand should concentrate on larger, more expensive cars.
The Volkswagen Polo range continued to evolve, with the Volkswagen Derby notchback version, despite being developed by Audi at Ingolstadt, branded as a Volkswagen and launched in 1977.  Subsequently, the Volkswagen Polo has evolved through numerous generations to the present day.
The Audi 50 had no replacement in the supermini class, until the launch of the significantly larger Audi A2 in November 1999, which was also discontinued in August 2005.
In August 2010, the Audi 50 was spiritually succeeded by the Audi A1.

"
41005157.0,0,Audi 5 Series DTM,The Audi 5 Series DTM (also known as the Audi A5 DTM (2012) later Audi RS5 DTM (2013-2018)) is a touring car constructed by the German car manufacturer Audi AG for use in the Deutsche Tourenwagen Masters. It was developed in 2011 and has been raced in DTM seasons 2012-2018 before being replaced by updated turbo version of Audi RS5 Turbo DTM from 2019 season onwards. It was designed by former Audi Head of Research and Development Wolfgang Dürheimer. The A5 DTM replaced the retired Audi A4 DTM at the end of the 2011 season and based on the production Audi A5.
620038.0,0,Audi 80,"The Audi 80 is a compact executive car produced by the Audi subdivision of the Volkswagen Group across four generations from 1966 to 1996. It shared its platform with the Volkswagen Passat from 1973 to 1986 and was available as a saloon, and station wagon — the latter marketed by Audi as the Avant. The coupé and convertible models were not badged as members of the range but used a derivative of the same platforms.
In North America and Australia, the 80 was marketed as the Audi Fox for model years 1973–79, and as the Audi 4000 for model years 1980–87 in the US. The Audi 90 was an upmarket version of the Audi 80, although all North American sedans of the B4 generation were called Audi 90."
